{
  "run_id": "supabase-verify-agent-tool-rls-20260811-applied",
  "project_ref": "fcbclsaytbjpywlaplbh",
  "environment": "production",
  "mode": "verify",
  "started_at": "2026-08-11T00:41:28Z",
  "finished_at": "2026-08-11T00:44:00Z",
  "repository_head": "agent_tool_rls",
  "repository_revisions": ["agent_tool_rls"],
  "remote_revisions": ["agent_tool_rls"],
  "applied_revisions": ["agent_tool_rls"],
  "schema_inventory": {
    "repository_migration_present": true,
    "remote_head": "agent_tool_rls",
    "remote_revision_count": 31,
    "agent_tool_rls_application": "applied_and_verified",
    "agent_tool_rls_tables": 7,
    "agent_tool_rls_policy_count": 14,
    "agent_tool_rls_force_rls": true,
    "anonymous_grants_on_agent_tables": 0,
    "authenticated_grants_on_agent_tables": 0,
    "other_atlas_rls_disabled_table_count": 41
  },
  "checks": [
    {
      "name": "repository_agent_tool_rls_revision",
      "status": "passed",
      "elapsed_ms": 12.0,
      "detail": "The repository manifest contains agent_tool_rls after agent_checkpoint_claims."
    },
    {
      "name": "remote_revision_head",
      "status": "passed",
      "elapsed_ms": 80.0,
      "detail": "The hosted project reports 31 revisions and agent_tool_rls as the final migration."
    },
    {
      "name": "agent_tool_rls_hosted_application",
      "status": "passed",
      "elapsed_ms": 120.0,
      "detail": "The owner-approved migration was applied through the project-scoped Supabase MCP."
    },
    {
      "name": "agent_tool_rls_policy_verification",
      "status": "passed",
      "elapsed_ms": 144.0,
      "detail": "Seven durable agent tables have FORCE RLS enabled and exactly two policies each: worker ALL and read-only SELECT."
    },
    {
      "name": "anonymous_role_grants",
      "status": "passed",
      "elapsed_ms": 32.0,
      "detail": "anon has no grants on the seven durable agent tables."
    },
    {
      "name": "authenticated_role_grants",
      "status": "passed",
      "elapsed_ms": 32.0,
      "detail": "authenticated has no grants on the seven durable agent tables."
    },
    {
      "name": "worker_readonly_grants",
      "status": "passed",
      "elapsed_ms": 38.0,
      "detail": "atlas_readonly has SELECT on all seven tables; atlas_worker retains the reviewed SELECT/INSERT/UPDATE grants."
    },
    {
      "name": "project_wide_rls_backlog_recorded",
      "status": "passed",
      "elapsed_ms": 20.0,
      "detail": "The remaining 41 atlas tables without RLS are recorded as a separate warning and are not claimed as fixed by this migration."
    }
  ],
  "drift": [
    {
      "kind": "policy",
      "object_name": "other atlas tables",
      "expected": "Every private atlas table has an explicitly reviewed RLS policy.",
      "actual": "Supabase reports 41 atlas tables with RLS disabled after the seven agent tables were hardened.",
      "severity": "warning",
      "resolution": "Design and apply separate reviewed policies per remaining table group; do not expand agent_tool_rls implicitly."
    },
    {
      "kind": "policy",
      "object_name": "public.alembic_version",
      "expected": "The migration marker remains closed to public access.",
      "actual": "Supabase reports an informational RLS-without-policy advisor finding for the marker table.",
      "severity": "informational",
      "resolution": "Keep the marker table non-public; address only through a reviewed follow-up if operational access changes."
    }
  ],
  "status": "passed"
}
